[
  {
    "id": "ap-001",
    "vendor": "Alcatel",
    "model": "AP1301",
    "reference": "",
    "antenna_type": "Internal : omni downtilt",
    "indoor_outdoor": "Indoor",
    "generation": "Wi-Fi 6 (802.11ax)",
    "chipset": "",
    "product_positioning": "Entry-level",
    "total_phy_serving_radios": "2",
    "concurrent_serving_radios": "2",
    "serving_radio_1": "[2.4GHz] 2x2:2",
    "serving_radio_2": "[5GHz] 2x2:2",
    "serving_radio_3": "",
    "serving_radio_4": "",
    "dedicated_scanning_radio": "No",
    "poe_class": "802.3af Class 3 (15W)",
    "max_poe_consumption_w": "13.1",
    "limited_capabilities_poe_bt": "",
    "limited_capabilities_poe_at": "",
    "limited_capabilities_poe_af": "",
    "ethernet1": "1 Gbits",
    "ethernet2": "",
    "weight_kg": "0.57",
    "dimensions_cm": "18 x 18 x 3,6",
    "geolocation": "No",
    "usb_ports": "1",
    "uwb": "No",
    "gnss": "No",
    "bluetooth": "No",
    "zigbee": "No",
    "minimum_software_version": "",
    "maximum_software_version": "",
    "end_of_sale_date": "",
    "end_of_support_date": "",
    "public_price_usd": "",
    "public_price_eur": "",
    "comments": ""
  },
  {
    "id": "ap-002",
    "vendor": "Alcatel",
    "model": "AP1311",
    "reference": "",
    "antenna_type": "Internal : omni downtilt",
    "indoor_outdoor": "Indoor",
    "generation": "Wi-Fi 6 (802.11ax)",
    "chipset": "",
    "product_positioning": "Entry-level",
    "total_phy_serving_radios": "2",
    "concurrent_serving_radios": "2",
    "serving_radio_1": "[2.4GHz] 2x2:2",
    "serving_radio_2": "[5GHz] 2x2:2",
    "serving_radio_3": "",
    "serving_radio_4": "",
    "dedicated_scanning_radio": "Yes",
    "poe_class": "802.3at Class 4 (30W)",
    "max_poe_consumption_w": "19.1",
    "limited_capabilities_poe_bt": "",
    "limited_capabilities_poe_at": "",
    "limited_capabilities_poe_af": "USB disabled",
    "ethernet1": "1 Gbits",
    "ethernet2": "1 Gbits, PoE",
    "weight_kg": "0.58",
    "dimensions_cm": "18 x 18 x 3,6",
    "geolocation": "No",
    "usb_ports": "1",
    "uwb": "No",
    "gnss": "No",
    "bluetooth": "Yes",
    "zigbee": "Yes",
    "minimum_software_version": "",
    "maximum_software_version": "",
    "end_of_sale_date": "",
    "end_of_support_date": "",
    "public_price_usd": "",
    "public_price_eur": "",
    "comments": ""
  },
  {
    "id": "ap-003",
    "vendor": "Alcatel",
    "model": "AP1321",
    "reference": "",
    "antenna_type": "Internal : omni downtilt",
    "indoor_outdoor": "Indoor",
    "generation": "Wi-Fi 6 (802.11ax)",
    "chipset": "",
    "product_positioning": "Mid-range",
    "total_phy_serving_radios": "2",
    "concurrent_serving_radios": "2",
    "serving_radio_1": "[2.4GHz] 2x2:2",
    "serving_radio_2": "[5GHz] 4x4:4",
    "serving_radio_3": "",
    "serving_radio_4": "",
    "dedicated_scanning_radio": "Yes",
    "poe_class": "802.3at Class 4 (30W)",
    "max_poe_consumption_w": "24.8",
    "limited_capabilities_poe_bt": "",
    "limited_capabilities_poe_at": "",
    "limited_capabilities_poe_af": "Radios 2x2:2, USB disabled",
    "ethernet1": "2,5 Gbits",
    "ethernet2": "",
    "weight_kg": "0.75",
    "dimensions_cm": "18 x 18 x 3,6",
    "geolocation": "No",
    "usb_ports": "1",
    "uwb": "No",
    "gnss": "No",
    "bluetooth": "Yes",
    "zigbee": "Yes",
    "minimum_software_version": "",
    "maximum_software_version": "",
    "end_of_sale_date": "",
    "end_of_support_date": "",
    "public_price_usd": "",
    "public_price_eur": "",
    "comments": ""
  },
  {
    "id": "ap-004",
    "vendor": "Alcatel",
    "model": "AP1322",
    "reference": "",
    "antenna_type": "External : 4x RP-SMA",
    "indoor_outdoor": "Indoor",
    "generation": "Wi-Fi 6 (802.11ax)",
    "chipset": "",
    "product_positioning": "Mid-range",
    "total_phy_serving_radios": "2",
    "concurrent_serving_radios": "2",
    "serving_radio_1": "[2.4GHz] 2x2:2",
    "serving_radio_2": "[5GHz] 4x4:4",
    "serving_radio_3": "",
    "serving_radio_4": "",
    "dedicated_scanning_radio": "Yes",
    "poe_class": "802.3at Class 4 (30W)",
    "max_poe_consumption_w": "24.8",
    "limited_capabilities_poe_bt": "",
    "limited_capabilities_poe_at": "",
    "limited_capabilities_poe_af": "Radios 2x2:2, USB disabled",
    "ethernet1": "2,5 Gbits",
    "ethernet2": "",
    "weight_kg": "0.75",
    "dimensions_cm": "18 x 18 x 3,6",
    "geolocation": "No",
    "usb_ports": "1",
    "uwb": "No",
    "gnss": "No",
    "bluetooth": "Yes",
    "zigbee": "Yes",
    "minimum_software_version": "",
    "maximum_software_version": "",
    "end_of_sale_date": "",
    "end_of_support_date": "",
    "public_price_usd": "",
    "public_price_eur": "",
    "comments": ""
  },
  {
    "id": "ap-005",
    "vendor": "Alcatel",
    "model": "AP1331",
    "reference": "",
    "antenna_type": "Internal : omni downtilt",
    "indoor_outdoor": "Indoor",
    "generation": "Wi-Fi 6 (802.11ax)",
    "chipset": "",
    "product_positioning": "High-end",
    "total_phy_serving_radios": "2",
    "concurrent_serving_radios": "2",
    "serving_radio_1": "[2.4GHz] 4x4:4",
    "serving_radio_2": "[5GHz] 4x4:4",
    "serving_radio_3": "",
    "serving_radio_4": "",
    "dedicated_scanning_radio": "Yes",
    "poe_class": "802.3bt Class 5 (45W)",
    "max_poe_consumption_w": "28",
    "limited_capabilities_poe_bt": "",
    "limited_capabilities_poe_at": "USB disabled",
    "limited_capabilities_poe_af": "USB disabled, Eth2 disabled",
    "ethernet1": "10 Gbits",
    "ethernet2": "10 Gbits, PoE",
    "weight_kg": "0.98",
    "dimensions_cm": "21 x 21 x 40",
    "geolocation": "No",
    "usb_ports": "1",
    "uwb": "No",
    "gnss": "No",
    "bluetooth": "Yes",
    "zigbee": "Yes",
    "minimum_software_version": "",
    "maximum_software_version": "",
    "end_of_sale_date": "",
    "end_of_support_date": "",
    "public_price_usd": "",
    "public_price_eur": "",
    "comments": ""
  },
  {
    "id": "ap-006",
    "vendor": "Alcatel",
    "model": "AP1351",
    "reference": "",
    "antenna_type": "Internal : omni downtilt",
    "indoor_outdoor": "Indoor",
    "generation": "Wi-Fi 6 (802.11ax)",
    "chipset": "",
    "product_positioning": "High-end",
    "total_phy_serving_radios": "3",
    "concurrent_serving_radios": "3",
    "serving_radio_1": "[2.4GHz] 4x4:4",
    "serving_radio_2": "[5GHz] 4x4:4",
    "serving_radio_3": "[5GHz] 8x8:8",
    "serving_radio_4": "-",
    "dedicated_scanning_radio": "Yes",
    "poe_class": "802.3bt Class 6 (60W)",
    "max_poe_consumption_w": "45",
    "limited_capabilities_poe_bt": "",
    "limited_capabilities_poe_at": "Radios 2x2:2, USB disabled, Eth2 disabled",
    "limited_capabilities_poe_af": "Not supported",
    "ethernet1": "10 Gbits",
    "ethernet2": "10 Gbits, PoE",
    "weight_kg": "1.2",
    "dimensions_cm": "26 x 26 x 6",
    "geolocation": "No",
    "usb_ports": "1",
    "uwb": "No",
    "gnss": "No",
    "bluetooth": "Yes",
    "zigbee": "Yes",
    "minimum_software_version": "",
    "maximum_software_version": "",
    "end_of_sale_date": "",
    "end_of_support_date": "",
    "public_price_usd": "",
    "public_price_eur": "",
    "comments": ""
  },
  {
    "id": "ap-007",
    "vendor": "Alcatel",
    "model": "AP1511",
    "reference": "",
    "antenna_type": "Internal : omni downtilt",
    "indoor_outdoor": "Indoor",
    "generation": "Wi-Fi 7 (802.11be)",
    "chipset": "",
    "product_positioning": "Entry-level",
    "total_phy_serving_radios": "3",
    "concurrent_serving_radios": "3",
    "serving_radio_1": "[2.4GHz] 2x2:2",
    "serving_radio_2": "[5GHz] 2x2:2",
    "serving_radio_3": "[6GHz] 2x2:2",
    "serving_radio_4": "",
    "dedicated_scanning_radio": "Yes",
    "poe_class": "802.3at Class 4 (30W)",
    "max_poe_consumption_w": "23.4",
    "limited_capabilities_poe_bt": "",
    "limited_capabilities_poe_at": "",
    "limited_capabilities_poe_af": "",
    "ethernet1": "5 Gbits",
    "ethernet2": "",
    "weight_kg": "0.764",
    "dimensions_cm": "19 x 19 x 3,8",
    "geolocation": "No",
    "usb_ports": "1",
    "uwb": "No",
    "gnss": "No",
    "bluetooth": "Yes",
    "zigbee": "Yes",
    "minimum_software_version": "",
    "maximum_software_version": "",
    "end_of_sale_date": "",
    "end_of_support_date": "",
    "public_price_usd": "",
    "public_price_eur": "",
    "comments": ""
  },
  {
    "id": "ap-008",
    "vendor": "Alcatel",
    "model": "AP1521",
    "reference": "",
    "antenna_type": "Internal : omni downtilt",
    "indoor_outdoor": "Indoor",
    "generation": "Wi-Fi 7 (802.11be)",
    "chipset": "",
    "product_positioning": "Mid-range",
    "total_phy_serving_radios": "3",
    "concurrent_serving_radios": "3",
    "serving_radio_1": "[2.4GHz] 2x2:2",
    "serving_radio_2": "[5GHz] 4x4:4",
    "serving_radio_3": "[6GHz] 2x2:2",
    "serving_radio_4": "",
    "dedicated_scanning_radio": "Yes",
    "poe_class": "802.3bt Class 6 (60W)",
    "max_poe_consumption_w": "40.2",
    "limited_capabilities_poe_bt": "",
    "limited_capabilities_poe_at": "3rd radio disabled, USB disabled",
    "limited_capabilities_poe_af": "",
    "ethernet1": "10 Gbits",
    "ethernet2": "1 Gbits, no PoE",
    "weight_kg": "1.02",
    "dimensions_cm": "21 x 21 x 4,3",
    "geolocation": "No",
    "usb_ports": "1",
    "uwb": "No",
    "gnss": "No",
    "bluetooth": "Yes",
    "zigbee": "Yes",
    "minimum_software_version": "",
    "maximum_software_version": "",
    "end_of_sale_date": "",
    "end_of_support_date": "",
    "public_price_usd": "",
    "public_price_eur": "",
    "comments": ""
  },
  {
    "id": "ap-009",
    "vendor": "Alcatel",
    "model": "AP1411",
    "reference": "",
    "antenna_type": "Internal : omni downtilt",
    "indoor_outdoor": "Indoor",
    "generation": "Wi-Fi 6E (802.11ax)",
    "chipset": "",
    "product_positioning": "Entry-level",
    "total_phy_serving_radios": "3",
    "concurrent_serving_radios": "2",
    "serving_radio_1": "[2.4GHz] 2x2:2",